11:13:02.688693 IP AcuRite-Hub.localdomain.ansoft-lm-1 > ec2-52-3-67-229.compute-1.amazonaws.com.http: Flags [S], seq 969618941, win 400, options [mss 536], length 0
E..,....d...
..G4.C..;.P9.5.....`.............
11:13:02.724649 IP ec2-52-3-67-229.compute-1.amazonaws.com.http > AcuRite-Hub.localdomain.ansoft-lm-1: Flags [S.], seq 3121426016, ack 969618942, win 26883, options [mss 1460], length 0
E..,..@....4.C.
..G.P.;..`9.5.`.i.O!......
11:13:02.726281 IP AcuRite-Hub.localdomain.ansoft-lm-1 > ec2-52-3-67-229.compute-1.amazonaws.com.http: Flags [.], ack 1, win 400, length 0
E..(....d...
..G4.C..;.P9.5...aP....Q........
11:13:02.728248 IP AcuRite-Hub.localdomain.ansoft-lm-1 > ec2-52-3-67-229.compute-1.amazonaws.com.http: Flags [P.], seq 1:81, ack 1, win 400, length 80
E..x....d..Y
..G4.C..;.P9.5...aP...	...GET /weatherstation/updateweatherstation?dateutc=now&action=updateraw&realtime=1
11:13:02.762164 IP ec2-52-3-67-229.compute-1.amazonaws.com.http > AcuRite-Hub.localdomain.ansoft-lm-1: Flags [.], ack 81, win 26883, length 0
E..(.'@...xx4.C.
..G.P.;..a9.6NP.i.f...
11:13:02.762193 IP ec2-52-3-67-229.compute-1.amazonaws.com.http > AcuRite-Hub.localdomain.ansoft-lm-1: Flags [.], ack 81, win 26883, length 0
E..(.(@...xw4.C.
..G.P.;..a9.6NP.i.f...
11:13:02.767134 IP AcuRite-Hub.localdomain.ansoft-lm-1 > ec2-52-3-67-229.compute-1.amazonaws.com.http: Flags [P.], seq 81:123, ack 1, win 400, length 42
E..R....d..~
..G4.C..;.P9.6N..aP.......&id=24C86E0785BB&mt=5N1x38&sensor=00000655
11:13:02.769415 IP AcuRite-Hub.localdomain.ansoft-lm-1 > ec2-52-3-67-229.compute-1.amazonaws.com.http: Flags [P.], seq 123:150, ack 1, win 400, length 27
E..C....d...
..G4.C..;.P9.6x..aP.......&windspeedmph=0&humidity=70
11:13:02.771646 IP AcuRite-Hub.localdomain.ansoft-lm-1 > ec2-52-3-67-229.compute-1.amazonaws.com.http: Flags [P.], seq 150:161, ack 1, win 400, length 11
E..3....d...
..G4.C..;.P9.6...aP...&...&tempf=69.4
11:13:02.778481 IP AcuRite-Hub.localdomain.ansoft-lm-1 > ec2-52-3-67-229.compute-1.amazonaws.com.http: Flags [P.], seq 161:197, ack 1, win 400, length 36
E..L....d...
..G4.C..;.P9.6...aP.......&baromin=30.47&battery=normal&rssi=3
11:13:02.799633 IP ec2-52-3-67-229.compute-1.amazonaws.com.http > AcuRite-Hub.localdomain.ansoft-lm-1: Flags [.], ack 123, win 26883, length 0
E..(.)@...xv4.C.
..G.P.;..a9.6xP.i.fd..
11:13:02.801881 IP ec2-52-3-67-229.compute-1.amazonaws.com.http > AcuRite-Hub.localdomain.ansoft-lm-1: Flags [.], ack 150, win 26883, length 0
E..(.*@...xu4.C.
..G.P.;..a9.6.P.i.fI..
11:13:02.802195 IP AcuRite-Hub.localdomain.ansoft-lm-1 > ec2-52-3-67-229.compute-1.amazonaws.com.http: Flags [P.], seq 197:214, ack 1, win 400, length 17
E..9....d...
..G4.C..;.P9.6...aP....w.. HTTP/1.1
Host: 
11:13:02.804680 IP AcuRite-Hub.localdomain.ansoft-lm-1 > ec2-52-3-67-229.compute-1.amazonaws.com.http: Flags [P.], seq 214:252, ack 1, win 400, length 38
E..N....d..}
..G4.C..;.P9.6...aP...R[..hubapi.myacurite.com
User-Agent: Hub/
11:13:02.805236 IP AcuRite-Hub.localdomain.ansoft-lm-1 > ec2-52-3-67-229.compute-1.amazonaws.com.http: Flags [P.], seq 252:255, ack 1, win 400, length 3
E..+....d...
..G4.C..;.P9.6...aP...g...224...
11:13:02.809722 IP ec2-52-3-67-229.compute-1.amazonaws.com.http > AcuRite-Hub.localdomain.ansoft-lm-1: Flags [.], ack 161, win 26883, length 0
E..(.+@...xt4.C.
..G.P.;..a9.6.P.i.f>..
11:13:02.812465 IP AcuRite-Hub.localdomain.ansoft-lm-1 > ec2-52-3-67-229.compute-1.amazonaws.com.http: Flags [P.], seq 255:278, ack 1, win 400, length 23
E..?....d...
..G4.C..;.P9.6...aP...>...
Connection: close


11:13:02.816942 IP ec2-52-3-67-229.compute-1.amazonaws.com.http > AcuRite-Hub.localdomain.ansoft-lm-1: Flags [.], ack 197, win 26883, length 0
E..(.,@...xs4.C.
..G.P.;..a9.6.P.i.f...
11:13:02.836904 IP ec2-52-3-67-229.compute-1.amazonaws.com.http > AcuRite-Hub.localdomain.ansoft-lm-1: Flags [.], ack 214, win 26883, length 0
E..(.-@...xr4.C.
..G.P.;..a9.6.P.i.f	..
11:13:02.836925 IP ec2-52-3-67-229.compute-1.amazonaws.com.http > AcuRite-Hub.localdomain.ansoft-lm-1: Flags [.], ack 252, win 26883, length 0
E..(..@...xq4.C.
..G.P.;..a9.6.P.i.e...
11:13:02.836943 IP ec2-52-3-67-229.compute-1.amazonaws.com.http > AcuRite-Hub.localdomain.ansoft-lm-1: Flags [.], ack 255, win 26883, length 0
E..(./@...xp4.C.
..G.P.;..a9.6.P.i.e...
11:13:02.844735 IP ec2-52-3-67-229.compute-1.amazonaws.com.http > AcuRite-Hub.localdomain.ansoft-lm-1: Flags [.], ack 278, win 26883, length 0
E..(.0@...xo4.C.
..G.P.;..a9.7.P.i.e...
11:13:02.853474 IP ec2-52-3-67-229.compute-1.amazonaws.com.http > AcuRite-Hub.localdomain.ansoft-lm-1: Flags [P.], seq 1:401, ack 278, win 26883, length 400
E....1@...v.4.C.
..G.P.;..a9.7.P.i.a4..HTTP/1.1 200 OK
Cache-Control: no-cache, no-store
Content-Type: application/json; charset=utf-8
Expires: Fri, 01 Jan 1990 00:00:00 GMT
Pragma: no-cache
X-Content-Type-Options: nosniff
X-Frame-Options: SAMEORIGIN
X-Request-Id: 2c20d4a3-03d7-4ca8-89a7-e4666fa7dd5c
X-Runtime: 0.006647
X-XSS-Protection: 1; mode=block
Content-Length: 45
Connection: Close

{"localtime":"11:11:11","checkvers
11:13:02.860208 IP AcuRite-Hub.localdomain.ansoft-lm-1 > ec2-52-3-67-229.compute-1.amazonaws.com.http: Flags [.], ack 401, win 400, length 0
E..(....d...
..G4.C..;.P9.7../.P.............
11:13:02.896909 IP ec2-52-3-67-229.compute-1.amazonaws.com.http > AcuRite-Hub.localdomain.ansoft-lm-1: Flags [FP.], seq 401:412, ack 278, win 26883, length 11
E..3.2@...xb4.C.
..G.P.;./.9.7.P.i.o...ion":"224"}
11:13:02.898585 IP AcuRite-Hub.localdomain.ansoft-lm-1 > ec2-52-3-67-229.compute-1.amazonaws.com.http: Flags [.], ack 413, win 389, length 0
E..(....d...
..G4.C..;.P9.7../.P.............
11:13:02.899655 IP AcuRite-Hub.localdomain.ansoft-lm-1 > ec2-52-3-67-229.compute-1.amazonaws.com.http: Flags [.], ack 413, win 400, length 0
E..(....d...
..G4.C..;.P9.7../.P.............
11:13:02.900737 IP AcuRite-Hub.localdomain.ansoft-lm-1 > ec2-52-3-67-229.compute-1.amazonaws.com.http: Flags [F.], seq 278, ack 413, win 400, length 0
E..(....d...
..G4.C..;.P9.7../.P.............
11:13:02.901236 IP AcuRite-Hub.localdomain.ansoft-lm-1 > ec2-52-3-67-229.compute-1.amazonaws.com.http: Flags [R.], seq 278, ack 413, win 400, length 0
E..(....d...
..G4.C..;.P9.7../.P.............
11:13:02.934979 IP ec2-52-3-67-229.compute-1.amazonaws.com.http > AcuRite-Hub.localdomain.ansoft-lm-1: Flags [.], ack 279, win 26883, length 0
E..(..@...T.4.C.
..G.P.;./.9.7.P.i.d,..
11:13:05.584935 IP AcuRite-Hub.localdomain.ansoft-lm-2 > ec2-52-3-67-229.compute-1.amazonaws.com.http: Flags [S], seq 130555311, win 400, options [mss 536], length 0
E..,....d...
..G4.C..<.P........`.............
11:13:05.620454 IP ec2-52-3-67-229.compute-1.amazonaws.com.http > AcuRite-Hub.localdomain.ansoft-lm-2: Flags [S.], seq 3158345576, ack 130555312, win 26883, options [mss 1460], length 0
E..,..@.....4.C.
..G.P.<.@.h....`.i.>6......
11:13:05.622459 IP AcuRite-Hub.localdomain.ansoft-lm-2 > ec2-52-3-67-229.compute-1.amazonaws.com.http: Flags [.], ack 1, win 400, length 0
E..(....d...
..G4.C..<.P.....@.iP....f........
11:13:05.624477 IP AcuRite-Hub.localdomain.ansoft-lm-2 > ec2-52-3-67-229.compute-1.amazonaws.com.http: Flags [P.], seq 1:81, ack 1, win 400, length 80
E..x....d..H
..G4.C..<.P.....@.iP.......GET /weatherstation/updateweatherstation?dateutc=now&action=updateraw&realtime=1
11:13:05.660156 IP ec2-52-3-67-229.compute-1.amazonaws.com.http > AcuRite-Hub.localdomain.ansoft-lm-2: Flags [.], ack 81, win 26883, length 0
E..(9r@....-4.C.
..G.P.<.@.i....P.i.U...
11:13:05.664202 IP AcuRite-Hub.localdomain.ansoft-lm-2 > ec2-52-3-67-229.compute-1.amazonaws.com.http: Flags [P.], seq 81:122, ack 1, win 400, length 41
E..Q....d..n
..G4.C..<.P.....@.iP.......&id=24C86E0785BB&mt=tower&sensor=00004291
11:13:05.667073 IP AcuRite-Hub.localdomain.ansoft-lm-2 > ec2-52-3-67-229.compute-1.amazonaws.com.http: Flags [P.], seq 122:145, ack 1, win 400, length 23
E..?.	..d...
..G4.C..<.P...).@.iP.......&humidity=45&tempf=75.7
11:13:05.674852 IP AcuRite-Hub.localdomain.ansoft-lm-2 > ec2-52-3-67-229.compute-1.amazonaws.com.http: Flags [P.], seq 145:181, ack 1, win 400, length 36
E..L.
..d..q
..G4.C..<.P...@.@.iP....3..&baromin=30.46&battery=normal&rssi=4
11:13:05.676267 IP AcuRite-Hub.localdomain.ansoft-lm-2 > ec2-52-3-67-229.compute-1.amazonaws.com.http: Flags [P.], seq 181:198, ack 1, win 400, length 17
E..9....d...
..G4.C..<.P...d.@.iP....... HTTP/1.1
Host: 
11:13:05.678149 IP AcuRite-Hub.localdomain.ansoft-lm-2 > ec2-52-3-67-229.compute-1.amazonaws.com.http: Flags [P.], seq 198:239, ack 1, win 400, length 41
E..Q....d..j
..G4.C..<.P...u.@.iP....J..hubapi.myacurite.com
User-Agent: Hub/224
11:13:05.700401 IP ec2-52-3-67-229.compute-1.amazonaws.com.http > AcuRite-Hub.localdomain.ansoft-lm-2: Flags [.], ack 122, win 26883, length 0
E..(9s@....,4.C.
..G.P.<.@.i...)P.i.Uz..
11:13:05.700432 IP ec2-52-3-67-229.compute-1.amazonaws.com.http > AcuRite-Hub.localdomain.ansoft-lm-2: Flags [.], ack 145, win 26883, length 0
E..(9t@....+4.C.
..G.P.<.@.i...@P.i.Uc..
11:13:05.703588 IP AcuRite-Hub.localdomain.ansoft-lm-2 > ec2-52-3-67-229.compute-1.amazonaws.com.http: Flags [P.], seq 239:262, ack 1, win 400, length 23
E..?...d..{
..G4.C..<.P.....@.iP.......
Connection: close


11:13:05.710145 IP ec2-52-3-67-229.compute-1.amazonaws.com.http > AcuRite-Hub.localdomain.ansoft-lm-2: Flags [.], ack 181, win 26883, length 0
E..(9u@....*4.C.
..G.P.<.@.i...dP.i.U?..
11:13:05.710190 IP ec2-52-3-67-229.compute-1.amazonaws.com.http > AcuRite-Hub.localdomain.ansoft-lm-2: Flags [.], ack 198, win 26883, length 0
E..(9v@....)4.C.
..G.P.<.@.i...uP.i.U...
11:13:05.710653 IP ec2-52-3-67-229.compute-1.amazonaws.com.http > AcuRite-Hub.localdomain.ansoft-lm-2: Flags [.], ack 239, win 26883, length 0
E..(9w@....(4.C.
..G.P.<.@.i....P.i.U...
11:13:05.740724 IP ec2-52-3-67-229.compute-1.amazonaws.com.http > AcuRite-Hub.localdomain.ansoft-lm-2: Flags [.], ack 262, win 26883, length 0
E..(9x@....'4.C.
..G.P.<.@.i....P.i.T...
11:13:05.745409 IP ec2-52-3-67-229.compute-1.amazonaws.com.http > AcuRite-Hub.localdomain.ansoft-lm-2: Flags [P.], seq 1:401, ack 262, win 26883, length 400
E...9y@.....4.C.
..G.P.<.@.i....P.i.(...HTTP/1.1 200 OK
Cache-Control: no-cache, no-store
Content-Type: application/json; charset=utf-8
Expires: Fri, 01 Jan 1990 00:00:00 GMT
Pragma: no-cache
X-Content-Type-Options: nosniff
X-Frame-Options: SAMEORIGIN
X-Request-Id: 621f6f65-d4d9-4bf1-b57a-9a5510b32f89
X-Runtime: 0.003602
X-XSS-Protection: 1; mode=block
Content-Length: 45
Connection: Close

{"localtime":"11:11:11","checkvers
11:13:05.752099 IP AcuRite-Hub.localdomain.ansoft-lm-2 > ec2-52-3-67-229.compute-1.amazonaws.com.http: Flags [.], ack 401, win 400, length 0
E..(....d...
..G4.C..<.P.....@..P.............
11:13:05.790258 IP ec2-52-3-67-229.compute-1.amazonaws.com.http > AcuRite-Hub.localdomain.ansoft-lm-2: Flags [FP.], seq 401:412, ack 262, win 26883, length 11
E..39z@.....4.C.
..G.P.<.@......P.i.^A..ion":"224"}
11:13:05.791902 IP AcuRite-Hub.localdomain.ansoft-lm-2 > ec2-52-3-67-229.compute-1.amazonaws.com.http: Flags [.], ack 413, win 389, length 0
E..(....d...
..G4.C..<.P.....@..P.............
11:13:05.792997 IP AcuRite-Hub.localdomain.ansoft-lm-2 > ec2-52-3-67-229.compute-1.amazonaws.com.http: Flags [.], ack 413, win 400, length 0
E..(....d...
..G4.C..<.P.....@..P.............
11:13:05.794078 IP AcuRite-Hub.localdomain.ansoft-lm-2 > ec2-52-3-67-229.compute-1.amazonaws.com.http: Flags [F.], seq 262, ack 413, win 400, length 0
E..(....d...
..G4.C..<.P.....@..P.............
11:13:05.794575 IP AcuRite-Hub.localdomain.ansoft-lm-2 > ec2-52-3-67-229.compute-1.amazonaws.com.http: Flags [R.], seq 262, ack 413, win 400, length 0
E..(....d...
..G4.C..<.P.....@..P.............
11:13:05.830830 IP ec2-52-3-67-229.compute-1.amazonaws.com.http > AcuRite-Hub.localdomain.ansoft-lm-2: Flags [.], ack 263, win 26883, length 0
E..(..@...S.4.C.
..G.P.<.@......P.i.SQ..
11:13:14.554469 IP AcuRite-Hub.localdomain.webobjects > ec2-52-3-67-229.compute-1.amazonaws.com.http: Flags [S], seq 2395815662, win 400, options [mss 536], length 0
E..,....d...
..G4.C..=.P..>.....`...D.........
11:13:14.598471 IP ec2-52-3-67-229.compute-1.amazonaws.com.http > AcuRite-Hub.localdomain.webobjects: Flags [S.], seq 3402978204, ack 2395815663, win 26883, options [mss 1460], length 0
E..,..@.....4.C.
..G.P.=..S...>.`.i..'......
11:13:14.600502 IP AcuRite-Hub.localdomain.webobjects > ec2-52-3-67-229.compute-1.amazonaws.com.http: Flags [.], ack 1, win 400, length 0
E..(....d...
..G4.C..=.P..>...S.P...:X........
11:13:14.602515 IP AcuRite-Hub.localdomain.webobjects > ec2-52-3-67-229.compute-1.amazonaws.com.http: Flags [P.], seq 1:81, ack 1, win 400, length 80
E..x....d..9
..G4.C..=.P..>...S.P...u...GET /weatherstation/updateweatherstation?dateutc=now&action=updateraw&realtime=1
11:13:14.640706 IP ec2-52-3-67-229.compute-1.amazonaws.com.http > AcuRite-Hub.localdomain.webobjects: Flags [.], ack 81, win 26883, length 0
E..(.B@...y]4.C.
..G.P.=..S...??P.i.....
11:13:14.645102 IP AcuRite-Hub.localdomain.webobjects > ec2-52-3-67-229.compute-1.amazonaws.com.http: Flags [P.], seq 81:122, ack 1, win 400, length 41
E..Q....d.._
..G4.C..=.P..??..S.P.......&id=24C86E0785BB&mt=tower&sensor=00003824
11:13:14.647980 IP AcuRite-Hub.localdomain.webobjects > ec2-52-3-67-229.compute-1.amazonaws.com.http: Flags [P.], seq 122:145, ack 1, win 400, length 23
E..?....d..p
..G4.C..=.P..?h..S.P...z...&humidity=50&tempf=71.7
11:13:14.655759 IP AcuRite-Hub.localdomain.webobjects > ec2-52-3-67-229.compute-1.amazonaws.com.http: Flags [P.], seq 145:181, ack 1, win 400, length 36
E..L....d..b
..G4.C..=.P..?...S.P....&..&baromin=30.46&battery=normal&rssi=3
11:13:14.657222 IP AcuRite-Hub.localdomain.webobjects > ec2-52-3-67-229.compute-1.amazonaws.com.http: Flags [P.], seq 181:198, ack 1, win 400, length 17
E..9....d..t
..G4.C..=.P..?...S.P....... HTTP/1.1
Host: 
11:13:14.659053 IP AcuRite-Hub.localdomain.webobjects > ec2-52-3-67-229.compute-1.amazonaws.com.http: Flags [P.], seq 198:239, ack 1, win 400, length 41
E..Q....d..[
..G4.C..=.P..?...S.P...X<..hubapi.myacurite.com
User-Agent: Hub/224
11:13:14.679192 IP ec2-52-3-67-229.compute-1.amazonaws.com.http > AcuRite-Hub.localdomain.webobjects: Flags [.], ack 122, win 26883, length 0
E..(.C@...y\4.C.
..G.P.=..S...?hP.i..k..
11:13:14.687913 IP ec2-52-3-67-229.compute-1.amazonaws.com.http > AcuRite-Hub.localdomain.webobjects: Flags [.], ack 145, win 26883, length 0
E..(.D@...y[4.C.
..G.P.=..S...?.P.i..T..
11:13:14.690605 IP AcuRite-Hub.localdomain.webobjects > ec2-52-3-67-229.compute-1.amazonaws.com.http: Flags [P.], seq 239:262, ack 1, win 400, length 23
E..?....d..l
..G4.C..=.P..?...S.P......
Connection: close


11:13:14.693376 IP ec2-52-3-67-229.compute-1.amazonaws.com.http > AcuRite-Hub.localdomain.webobjects: Flags [.], ack 181, win 26883, length 0
E..(.E@...yZ4.C.
..G.P.=..S...?.P.i..0..
11:13:14.693406 IP ec2-52-3-67-229.compute-1.amazonaws.com.http > AcuRite-Hub.localdomain.webobjects: Flags [.], ack 198, win 26883, length 0
E..(.F@...yY4.C.
..G.P.=..S...?.P.i.....
11:13:14.693651 IP ec2-52-3-67-229.compute-1.amazonaws.com.http > AcuRite-Hub.localdomain.webobjects: Flags [.], ack 239, win 26883, length 0
E..(.G@...yX4.C.
..G.P.=..S...?.P.i.....
11:13:14.728872 IP ec2-52-3-67-229.compute-1.amazonaws.com.http > AcuRite-Hub.localdomain.webobjects: Flags [.], ack 262, win 26883, length 0
E..(.H@...yW4.C.
..G.P.=..S...?.P.i.....
11:13:14.735414 IP ec2-52-3-67-229.compute-1.amazonaws.com.http > AcuRite-Hub.localdomain.webobjects: Flags [P.], seq 1:401, ack 262, win 26883, length 400
E....I@...w.4.C.
..G.P.=..S...?.P.i.....HTTP/1.1 200 OK
Cache-Control: no-cache, no-store
Content-Type: application/json; charset=utf-8
Expires: Fri, 01 Jan 1990 00:00:00 GMT
Pragma: no-cache
X-Content-Type-Options: nosniff
X-Frame-Options: SAMEORIGIN
X-Request-Id: e56e080f-042e-4224-b703-3f55efc9da3d
X-Runtime: 0.005468
X-XSS-Protection: 1; mode=block
Content-Length: 45
Connection: Close

{"localtime":"11:11:11","checkvers
11:13:14.742037 IP AcuRite-Hub.localdomain.webobjects > ec2-52-3-67-229.compute-1.amazonaws.com.http: Flags [.], ack 401, win 400, length 0
E..(....d...
..G4.C..=.P..?...U-P...7.........
11:13:14.783151 IP ec2-52-3-67-229.compute-1.amazonaws.com.http > AcuRite-Hub.localdomain.webobjects: Flags [FP.], seq 401:412, ack 262, win 26883, length 11
E..3.J@...yJ4.C.
..G.P.=..U-..?.P.i..2..ion":"224"}
11:13:14.784740 IP AcuRite-Hub.localdomain.webobjects > ec2-52-3-67-229.compute-1.amazonaws.com.http: Flags [.], ack 413, win 389, length 0
E..(....d...
..G4.C..=.P..?...U9P...7.........
11:13:14.785805 IP AcuRite-Hub.localdomain.webobjects > ec2-52-3-67-229.compute-1.amazonaws.com.http: Flags [.], ack 413, win 400, length 0
E..(....d...
..G4.C..=.P..?...U9P...7.........
11:13:14.786877 IP AcuRite-Hub.localdomain.webobjects > ec2-52-3-67-229.compute-1.amazonaws.com.http: Flags [F.], seq 262, ack 413, win 400, length 0
E..(. ..d...
..G4.C..=.P..?...U9P...7.........
11:13:14.787406 IP AcuRite-Hub.localdomain.webobjects > ec2-52-3-67-229.compute-1.amazonaws.com.http: Flags [R.], seq 262, ack 413, win 400, length 0
E..(.!..d..~
..G4.C..=.P..?...U9P...7.........
11:13:14.823881 IP ec2-52-3-67-229.compute-1.amazonaws.com.http > AcuRite-Hub.localdomain.webobjects: Flags [.], ack 263, win 26883, length 0
E..(..@...O.4.C.
..G.P.=..U9..?.P.i..B..
11:13:20.938806 IP AcuRite-Hub.localdomain.1086 > ec2-52-3-67-229.compute-1.amazonaws.com.http: Flags [S], seq 3745876209, win 400, options [mss 536], length 0
E..,.#..d..x
..G4.C..>.P.E......`....=........
11:13:20.976082 IP ec2-52-3-67-229.compute-1.amazonaws.com.http > AcuRite-Hub.localdomain.1086: Flags [S.], seq 4032525412, ack 3745876210, win 26883, options [mss 1460], length 0
E..,..@.....4.C.
..G.P.>.[td.E..`.i..\......
11:13:20.977791 IP AcuRite-Hub.localdomain.1086 > ec2-52-3-67-229.compute-1.amazonaws.com.http: Flags [.], ack 1, win 400, length 0
E..(.$..d..{
..G4.C..>.P.E...[teP...Y.........
11:13:20.979775 IP AcuRite-Hub.localdomain.1086 > ec2-52-3-67-229.compute-1.amazonaws.com.http: Flags [P.], seq 1:81, ack 1, win 400, length 80
E..x.%..d..*
..G4.C..>.P.E...[teP.......GET /weatherstation/updateweatherstation?dateutc=now&action=updateraw&realtime=1
11:13:21.015042 IP ec2-52-3-67-229.compute-1.amazonaws.com.http > AcuRite-Hub.localdomain.1086: Flags [.], ack 81, win 26883, length 0
E..(.|@...U#4.C.
..G.P.>.[te.E.BP.i.....
11:13:21.019448 IP AcuRite-Hub.localdomain.1086 > ec2-52-3-67-229.compute-1.amazonaws.com.http: Flags [P.], seq 81:123, ack 1, win 400, length 42
E..R.&..d..O
..G4.C..>.P.E.B.[teP.......&id=24C86E0785BB&mt=5N1x31&sensor=00000655
11:13:21.021386 IP AcuRite-Hub.localdomain.1086 > ec2-52-3-67-229.compute-1.amazonaws.com.http: Flags [P.], seq 123:150, ack 1, win 400, length 27
E..C.'..d..]
..G4.C..>.P.E.l.[teP...jM..&windspeedmph=0&winddir=270
11:13:21.026887 IP AcuRite-Hub.localdomain.1086 > ec2-52-3-67-229.compute-1.amazonaws.com.http: Flags [P.], seq 150:212, ack 1, win 400, length 62
E..f.(..d..9
..G4.C..>.P.E...[teP...^_..&rainin=0.00&dailyrainin=0.00&humidity=70&tempf=69.4&dewptf=59
11:13:21.054947 IP ec2-52-3-67-229.compute-1.amazonaws.com.http > AcuRite-Hub.localdomain.1086: Flags [.], ack 123, win 26883, length 0
E..(.}@...U"4.C.
..G.P.>.[te.E.lP.i.....
11:13:21.054965 IP ec2-52-3-67-229.compute-1.amazonaws.com.http > AcuRite-Hub.localdomain.1086: Flags [.], ack 150, win 26883, length 0
E..(.~@...U!4.C.
..G.P.>.[te.E..P.i.....
11:13:21.060123 IP ec2-52-3-67-229.compute-1.amazonaws.com.http > AcuRite-Hub.localdomain.1086: Flags [.], ack 212, win 26883, length 0
E..(..@...U 4.C.
..G.P.>.[te.E..P.i..F..
11:13:21.062955 IP AcuRite-Hub.localdomain.1086 > ec2-52-3-67-229.compute-1.amazonaws.com.http: Flags [P.], seq 212:248, ack 1, win 400, length 36
E..L.)..d..R
..G4.C..>.P.E...[teP...>...&baromin=30.46&battery=normal&rssi=3
11:13:21.065084 IP AcuRite-Hub.localdomain.1086 > ec2-52-3-67-229.compute-1.amazonaws.com.http: Flags [P.], seq 248:265, ack 1, win 400, length 17
E..9.*..d..d
..G4.C..>.P.E...[teP...#... HTTP/1.1
Host: 
11:13:21.066897 IP AcuRite-Hub.localdomain.1086 > ec2-52-3-67-229.compute-1.amazonaws.com.http: Flags [P.], seq 265:306, ack 1, win 400, length 41
E..Q.+..d..K
..G4.C..>.P.E...[teP...w...hubapi.myacurite.com
User-Agent: Hub/224
11:13:21.068428 IP AcuRite-Hub.localdomain.1086 > ec2-52-3-67-229.compute-1.amazonaws.com.http: Flags [P.], seq 306:329, ack 1, win 400, length 23
E..?.,..d..\
..G4.C..>.P.E.#.[teP.......
Connection: close


11:13:21.100067 IP ec2-52-3-67-229.compute-1.amazonaws.com.http > AcuRite-Hub.localdomain.1086: Flags [.], ack 248, win 26883, length 0
E..(..@...U.4.C.
..G.P.>.[te.E..P.i.."..
11:13:21.100863 IP ec2-52-3-67-229.compute-1.amazonaws.com.http > AcuRite-Hub.localdomain.1086: Flags [.], ack 265, win 26883, length 0
E..(..@...U.4.C.
..G.P.>.[te.E..P.i.....
11:13:21.100889 IP ec2-52-3-67-229.compute-1.amazonaws.com.http > AcuRite-Hub.localdomain.1086: Flags [.], ack 306, win 26883, length 0
E..(..@...U.4.C.
..G.P.>.[te.E.#P.i.....
11:13:21.104685 IP ec2-52-3-67-229.compute-1.amazonaws.com.http > AcuRite-Hub.localdomain.1086: Flags [.], ack 329, win 26883, length 0
E..(..@...U.4.C.
..G.P.>.[te.E.:P.i.....
11:13:21.111393 IP ec2-52-3-67-229.compute-1.amazonaws.com.http > AcuRite-Hub.localdomain.1086: Flags [P.], seq 1:401, ack 329, win 26883, length 400
E.....@...S.4.C.
..G.P.>.[te.E.:P.i.....HTTP/1.1 200 OK
Cache-Control: no-cache, no-store
Content-Type: application/json; charset=utf-8
Expires: Fri, 01 Jan 1990 00:00:00 GMT
Pragma: no-cache
X-Content-Type-Options: nosniff
X-Frame-Options: SAMEORIGIN
X-Request-Id: 61c812a7-0a68-4a52-8e21-d288fc55cd01
X-Runtime: 0.005739
X-XSS-Protection: 1; mode=block
Content-Length: 45
Connection: Close

{"localtime":"11:11:11","checkvers
11:13:21.118370 IP AcuRite-Hub.localdomain.1086 > ec2-52-3-67-229.compute-1.amazonaws.com.http: Flags [.], ack 401, win 400, length 0
E..(.-..d..r
..G4.C..>.P.E.:.[u.P...V.........
11:13:21.154949 IP ec2-52-3-67-229.compute-1.amazonaws.com.http > AcuRite-Hub.localdomain.1086: Flags [FP.], seq 401:412, ack 329, win 26883, length 11
E..3..@...U.4.C.
..G.P.>.[u..E.:P.i..$..ion":"224"}
11:13:21.156775 IP AcuRite-Hub.localdomain.1086 > ec2-52-3-67-229.compute-1.amazonaws.com.http: Flags [.], ack 413, win 389, length 0
E..(....d..q
..G4.C..>.P.E.:.[v.P...V.........
11:13:21.157839 IP AcuRite-Hub.localdomain.1086 > ec2-52-3-67-229.compute-1.amazonaws.com.http: Flags [.], ack 413, win 400, length 0
E..(./..d..p
..G4.C..>.P.E.:.[v.P...V.........
11:13:21.158921 IP AcuRite-Hub.localdomain.1086 > ec2-52-3-67-229.compute-1.amazonaws.com.http: Flags [F.], seq 329, ack 413, win 400, length 0
E..(.0..d..o
..G4.C..>.P.E.:.[v.P...V.........
11:13:21.159449 IP AcuRite-Hub.localdomain.1086 > ec2-52-3-67-229.compute-1.amazonaws.com.http: Flags [R.], seq 329, ack 413, win 400, length 0
E..(.1..d..n
..G4.C..>.P.E.:.[v.P...V.........
11:13:21.169967 IP AcuRite-Hub.localdomain.1087 > ec2-52-43-231-150.us-west-2.compute.amazonaws.com.http: Flags [S], seq 2615923252, win 400, options [mss 536], length 0
E..,.3..d.5.
..G4+...?.P...4....`....z........
11:13:21.190135 IP ec2-52-3-67-229.compute-1.amazonaws.com.http > AcuRite-Hub.localdomain.1086: Flags [R], seq 4032525825, win 0, length 0
E..(.~@...L!4.C.
..G.P.>.[v.....P.......
11:13:21.194633 IP ec2-52-3-67-229.compute-1.amazonaws.com.http > AcuRite-Hub.localdomain.1086: Flags [R], seq 4032525825, win 0, length 0
E..(..@...L 4.C.
..G.P.>.[v.....P.......
11:13:21.277264 IP ec2-52-43-231-150.us-west-2.compute.amazonaws.com.http > AcuRite-Hub.localdomain.1087: Flags [S.], seq 293996395, ack 2615923253, win 26883, options [mss 1460], length 0
E..,..@...n.4+..
..G.P.?...k...5`.i.|h......
11:13:21.279284 IP AcuRite-Hub.localdomain.1087 > ec2-52-43-231-150.us-west-2.compute.amazonaws.com.http: Flags [.], ack 1, win 400, length 0
E..(.4..d.5.
..G4+...?.P...5...lP.............
11:13:21.281991 IP AcuRite-Hub.localdomain.1087 > ec2-52-43-231-150.us-west-2.compute.amazonaws.com.http: Flags [P.], seq 1:117, ack 1, win 400, length 116
E....5..d.5.
..G4+...?.P...5...lP...&...GET /weatherstation/updateweatherstation.php?ID=KNCRALEI217&PASSWORD=hdr40mt&dateutc=now&action=updateraw&realtime=1
11:13:21.282370 IP AcuRite-Hub.localdomain.1087 > ec2-52-43-231-150.us-west-2.compute.amazonaws.com.http: Flags [P.], seq 117:127, ack 1, win 400, length 10
E..2.6..d.5.
..G4+...?.P.......lP...Ia..&rtfreq=36
11:13:21.387122 IP ec2-52-43-231-150.us-west-2.compute.amazonaws.com.http > AcuRite-Hub.localdomain.1087: Flags [.], ack 117, win 10720, length 0
E..(..@.....4+..
..G.P.?...l....P.).....
11:13:21.387162 IP ec2-52-43-231-150.us-west-2.compute.amazonaws.com.http > AcuRite-Hub.localdomain.1087: Flags [.], ack 117, win 10720, length 0
E..(..@.....4+..
..G.P.?...l....P.).....
11:13:21.387212 IP ec2-52-43-231-150.us-west-2.compute.amazonaws.com.http > AcuRite-Hub.localdomain.1087: Flags [.], ack 127, win 10720, length 0
E..(..@.....4+..
..G.P.?...l....P.).....
11:13:21.392566 IP AcuRite-Hub.localdomain.1087 > ec2-52-43-231-150.us-west-2.compute.amazonaws.com.http: Flags [P.], seq 127:169, ack 1, win 400, length 42
E..R.7..d.5e
..G4+...?.P.......lP.......&id=24C86E0785BB&mt=5N1x31&sensor=00000655
11:13:21.394462 IP AcuRite-Hub.localdomain.1087 > ec2-52-43-231-150.us-west-2.compute.amazonaws.com.http: Flags [P.], seq 169:196, ack 1, win 400, length 27
E..C.8..d.5s
..G4+...?.P.......lP....+..&windspeedmph=0&winddir=270
11:13:21.399970 IP AcuRite-Hub.localdomain.1087 > ec2-52-43-231-150.us-west-2.compute.amazonaws.com.http: Flags [P.], seq 196:258, ack 1, win 400, length 62
E..f.9..d.5O
..G4+...?.P.......lP....=..&rainin=0.00&dailyrainin=0.00&humidity=70&tempf=69.4&dewptf=59
11:13:21.496811 IP ec2-52-43-231-150.us-west-2.compute.amazonaws.com.http > AcuRite-Hub.localdomain.1087: Flags [.], ack 169, win 10720, length 0
E..(..@.....4+..
..G.P.?...l....P.).....
11:13:21.502112 IP ec2-52-43-231-150.us-west-2.compute.amazonaws.com.http > AcuRite-Hub.localdomain.1087: Flags [.], ack 196, win 10720, length 0
E..(..@.....4+..
..G.P.?...l....P.).....
11:13:21.507945 IP ec2-52-43-231-150.us-west-2.compute.amazonaws.com.http > AcuRite-Hub.localdomain.1087: Flags [.], ack 258, win 10720, length 0
E..(..@.....4+..
..G.P.?...l...6P.)..G..
11:13:21.509979 IP AcuRite-Hub.localdomain.1087 > ec2-52-43-231-150.us-west-2.compute.amazonaws.com.http: Flags [P.], seq 258:294, ack 1, win 400, length 36
E..L.:..d.5h
..G4+...?.P...6...lP.......&baromin=30.46&battery=normal&rssi=3
11:13:21.512092 IP AcuRite-Hub.localdomain.1087 > ec2-52-43-231-150.us-west-2.compute.amazonaws.com.http: Flags [P.], seq 294:311, ack 1, win 400, length 17
E..9.;..d.5z
..G4+...?.P...Z...lP....].. HTTP/1.1
Host: 
11:13:21.513649 IP AcuRite-Hub.localdomain.1087 > ec2-52-43-231-150.us-west-2.compute.amazonaws.com.http: Flags [P.], seq 311:336, ack 1, win 400, length 25
E..A.<..d.5q
..G4+...?.P...k...lP....g..rtupdate.wunderground.com
11:13:21.515166 IP AcuRite-Hub.localdomain.1087 > ec2-52-43-231-150.us-west-2.compute.amazonaws.com.http: Flags [P.], seq 336:359, ack 1, win 400, length 23
E..?.=..d.5r
..G4+...?.P.......lP...k...
Connection: close


11:13:21.618020 IP ec2-52-43-231-150.us-west-2.compute.amazonaws.com.http > AcuRite-Hub.localdomain.1087: Flags [.], ack 294, win 10720, length 0
E..(..@.....4+..
..G.P.?...l...ZP.)..#..
11:13:21.618048 IP ec2-52-43-231-150.us-west-2.compute.amazonaws.com.http > AcuRite-Hub.localdomain.1087: Flags [.], ack 311, win 10720, length 0
E..(..@.....4+..
..G.P.?...l...kP.).....
11:13:21.621889 IP ec2-52-43-231-150.us-west-2.compute.amazonaws.com.http > AcuRite-Hub.localdomain.1087: Flags [.], ack 336, win 10720, length 0
E..(..@.....4+..
..G.P.?...l....P.).....
11:13:21.622422 IP ec2-52-43-231-150.us-west-2.compute.amazonaws.com.http > AcuRite-Hub.localdomain.1087: Flags [.], ack 359, win 10720, length 0
E..(..@.....4+..
..G.P.?...l....P.).....
11:13:21.626900 IP ec2-52-43-231-150.us-west-2.compute.amazonaws.com.http > AcuRite-Hub.localdomain.1087: Flags [P.], seq 1:109, ack 359, win 10720, length 108
E.....@....Y4+..
..G.P.?...l....P.).va..HTTP/1.0 200 OK
Content-type: text/html
Date: Wed, 04 Oct 2017 15:13:21 GMT
Content-Length: 8

success

11:13:21.630540 IP AcuRite-Hub.localdomain.1087 > ec2-52-43-231-150.us-west-2.compute.amazonaws.com.http: Flags [.], ack 109, win 400, length 0
E..(.>..d.5.
..G4+...?.P........P.............
11:13:22.081620 IP ec2-52-43-231-150.us-west-2.compute.amazonaws.com.http > AcuRite-Hub.localdomain.1087: Flags [F.], seq 109, ack 359, win 10720, length 0
E..(..@.....4+..
..G.P.?........P.)..u..
11:13:22.083546 IP AcuRite-Hub.localdomain.1087 > ec2-52-43-231-150.us-west-2.compute.amazonaws.com.http: Flags [.], ack 110, win 400, length 0
E..(.?..d.5.
..G4+...?.P........P.............
11:13:22.085080 IP AcuRite-Hub.localdomain.1087 > ec2-52-43-231-150.us-west-2.compute.amazonaws.com.http: Flags [F.], seq 359, ack 110, win 400, length 0
E..(.@..d.5.
..G4+...?.P........P.............
11:13:22.085573 IP AcuRite-Hub.localdomain.1087 > ec2-52-43-231-150.us-west-2.compute.amazonaws.com.http: Flags [R.], seq 359, ack 110, win 400, length 0
E..(.A..d.5.
..G4+...?.P........P.............
11:13:22.187621 IP ec2-52-43-231-150.us-west-2.compute.amazonaws.com.http > AcuRite-Hub.localdomain.1087: Flags [.], ack 360, win 10720, length 0
E..(..@.....4+..
..G.P.?........P.)..t..
11:13:31.348205 IP AcuRite-Hub.localdomain.1088 > ec2-52-3-67-229.compute-1.amazonaws.com.http: Flags [S], seq 4084989085, win 400, options [mss 536], length 0
E..,.C..d..X
..G4.C..@.P.{......`..."Y........
11:13:31.384440 IP ec2-52-3-67-229.compute-1.amazonaws.com.http > AcuRite-Hub.localdomain.1088: Flags [S.], seq 1704456590, ack 4084989086, win 26883, options [mss 1460], length 0
E..,..@....4.C.
..G.P.@e....{..`.i.`.......
11:13:31.386422 IP AcuRite-Hub.localdomain.1088 > ec2-52-3-67-229.compute-1.amazonaws.com.http: Flags [.], ack 1, win 400, length 0
E..(.D..d..[
..G4.C..@.P.{..e...P....B........
11:13:31.388455 IP AcuRite-Hub.localdomain.1088 > ec2-52-3-67-229.compute-1.amazonaws.com.http: Flags [P.], seq 1:81, ack 1, win 400, length 80
E..x.E..d..

..G4.C..@.P.{..e...P....|..GET /weatherstation/updateweatherstation?dateutc=now&action=updateraw&realtime=1
11:13:31.425085 IP ec2-52-3-67-229.compute-1.amazonaws.com.http > AcuRite-Hub.localdomain.1088: Flags [.], ack 81, win 26883, length 0
E..(&.@.....4.C.
..G.P.@e....{..P.i.w...
11:13:31.429594 IP AcuRite-Hub.localdomain.1088 > ec2-52-3-67-229.compute-1.amazonaws.com.http: Flags [P.], seq 81:122, ack 1, win 400, length 41
E..Q.F..d..0
..G4.C..@.P.{..e...P.......&id=24C86E0785BB&mt=tower&sensor=00003824
11:13:31.432414 IP AcuRite-Hub.localdomain.1088 > ec2-52-3-67-229.compute-1.amazonaws.com.http: Flags [P.], seq 122:145, ack 1, win 400, length 23
E..?.G..d..A
..G4.C..@.P.{..e...P.......&humidity=50&tempf=71.7
11:13:31.440232 IP AcuRite-Hub.localdomain.1088 > ec2-52-3-67-229.compute-1.amazonaws.com.http: Flags [P.], seq 145:181, ack 1, win 400, length 36
E..L.H..d..3
..G4.C..@.P.{..e...P.......&baromin=30.46&battery=normal&rssi=3
11:13:31.441648 IP AcuRite-Hub.localdomain.1088 > ec2-52-3-67-229.compute-1.amazonaws.com.http: Flags [P.], seq 181:198, ack 1, win 400, length 17
E..9.I..d..E
..G4.C..@.P.{.Re...P....x.. HTTP/1.1
Host: 
11:13:31.443540 IP AcuRite-Hub.localdomain.1088 > ec2-52-3-67-229.compute-1.amazonaws.com.http: Flags [P.], seq 198:239, ack 1, win 400, length 41
E..Q.J..d..,
..G4.C..@.P.{.ce...P....&..hubapi.myacurite.com
User-Agent: Hub/224
11:13:31.466588 IP ec2-52-3-67-229.compute-1.amazonaws.com.http > AcuRite-Hub.localdomain.1088: Flags [.], ack 122, win 26883, length 0
E..(&.@.....4.C.
..G.P.@e....{..P.i.wV..
11:13:31.466622 IP ec2-52-3-67-229.compute-1.amazonaws.com.http > AcuRite-Hub.localdomain.1088: Flags [.], ack 145, win 26883, length 0
E..(&.@.....4.C.
..G.P.@e....{..P.i.w?..
11:13:31.469293 IP AcuRite-Hub.localdomain.1088 > ec2-52-3-67-229.compute-1.amazonaws.com.http: Flags [P.], seq 239:262, ack 1, win 400, length 23
E..?.K..d..=
..G4.C..@.P.{..e...P...O...
Connection: close


11:13:31.474344 IP ec2-52-3-67-229.compute-1.amazonaws.com.http > AcuRite-Hub.localdomain.1088: Flags [.], ack 181, win 26883, length 0
E..(&.@.....4.C.
..G.P.@e....{.RP.i.w...
11:13:31.474361 IP ec2-52-3-67-229.compute-1.amazonaws.com.http > AcuRite-Hub.localdomain.1088: Flags [.], ack 198, win 26883, length 0
E..(&.@.....4.C.
..G.P.@e....{.cP.i.w
..
11:13:31.476570 IP ec2-52-3-67-229.compute-1.amazonaws.com.http > AcuRite-Hub.localdomain.1088: Flags [.], ack 239, win 26883, length 0
E..(&.@.....4.C.
..G.P.@e....{..P.i.v...
11:13:31.506884 IP ec2-52-3-67-229.compute-1.amazonaws.com.http > AcuRite-Hub.localdomain.1088: Flags [.], ack 262, win 26883, length 0
E..(&.@.....4.C.
..G.P.@e....{..P.i.v...
11:13:31.516068 IP ec2-52-3-67-229.compute-1.amazonaws.com.http > AcuRite-Hub.localdomain.1088: Flags [P.], seq 1:401, ack 262, win 26883, length 400
E...&.@....<4.C.
..G.P.@e....{..P.i.....HTTP/1.1 200 OK
Cache-Control: no-cache, no-store
Content-Type: application/json; charset=utf-8
Expires: Fri, 01 Jan 1990 00:00:00 GMT
Pragma: no-cache
X-Content-Type-Options: nosniff
X-Frame-Options: SAMEORIGIN
X-Request-Id: 486afc2b-3686-47ea-860f-f447c33ef4e9
X-Runtime: 0.007814
X-XSS-Protection: 1; mode=block
Content-Length: 45
Connection: Close

{"localtime":"11:11:11","checkvers
11:13:31.522913 IP AcuRite-Hub.localdomain.1088 > ec2-52-3-67-229.compute-1.amazonaws.com.http: Flags [.], ack 401, win 400, length 0
E..(.L..d..S
..G4.C..@.P.{..e...P.............
11:13:31.559347 IP ec2-52-3-67-229.compute-1.amazonaws.com.http > AcuRite-Hub.localdomain.1088: Flags [FP.], seq 401:412, ack 262, win 26883, length 11
E..3&.@.....4.C.
..G.P.@e....{..P.i.....ion":"224"}
11:13:31.561259 IP AcuRite-Hub.localdomain.1088 > ec2-52-3-67-229.compute-1.amazonaws.com.http: Flags [.], ack 413, win 389, length 0
E..(.M..d..R
..G4.C..@.P.{..e..+P.............
11:13:31.562365 IP AcuRite-Hub.localdomain.1088 > ec2-52-3-67-229.compute-1.amazonaws.com.http: Flags [.], ack 413, win 400, length 0
E..(.N..d..Q
..G4.C..@.P.{..e..+P.............
11:13:31.563448 IP AcuRite-Hub.localdomain.1088 > ec2-52-3-67-229.compute-1.amazonaws.com.http: Flags [F.], seq 262, ack 413, win 400, length 0
E..(.O..d..P
..G4.C..@.P.{..e..+P.............
11:13:31.563946 IP AcuRite-Hub.localdomain.1088 > ec2-52-3-67-229.compute-1.amazonaws.com.http: Flags [R.], seq 262, ack 413, win 400, length 0
E..(.P..d..O
..G4.C..@.P.{..e..+P.............
11:13:31.596835 IP ec2-52-3-67-229.compute-1.amazonaws.com.http > AcuRite-Hub.localdomain.1088: Flags [R], seq 1704457003, win 0, length 0
E..(..@...F.4.C.
..G.P.@e..+....P....]..
11:13:31.596865 IP ec2-52-3-67-229.compute-1.amazonaws.com.http > AcuRite-Hub.localdomain.1088: Flags [R], seq 1704457003, win 0, length 0
E..(..@...F.4.C.
..G.P.@e..+....P....]..
11:13:38.358745 IP AcuRite-Hub.localdomain.1089 > ec2-52-6-137-198.compute-1.amazonaws.com.http: Flags [S], seq 1315155198, win 400, options [mss 536], length 0
E..,.R..d..e
..G4....A.PNc......`....+........
11:13:38.386394 IP ec2-52-6-137-198.compute-1.amazonaws.com.http > AcuRite-Hub.localdomain.1089: Flags [S.], seq 1824664596, ack 1315155199, win 26883, options [mss 1460], length 0
E..,..@.....4...
..G.P.Al.,.Nc..`.i..4......
11:13:38.387802 IP AcuRite-Hub.localdomain.1089 > ec2-52-6-137-198.compute-1.amazonaws.com.http: Flags [.], ack 1, win 400, length 0
E..(.S..d..h
..G4....A.PNc..l.,.P...Le........
11:13:38.389792 IP AcuRite-Hub.localdomain.1089 > ec2-52-6-137-198.compute-1.amazonaws.com.http: Flags [P.], seq 1:81, ack 1, win 400, length 80
E..x.T..d...
..G4....A.PNc..l.,.P.......GET /weatherstation/updateweatherstation?dateutc=now&action=updateraw&realtime=1
11:13:38.417114 IP ec2-52-6-137-198.compute-1.amazonaws.com.http > AcuRite-Hub.localdomain.1089: Flags [.], ack 81, win 26883, length 0
E..(.F@....u4...
..G.P.Al.,.Nc.OP.i.....
11:13:38.421600 IP AcuRite-Hub.localdomain.1089 > ec2-52-6-137-198.compute-1.amazonaws.com.http: Flags [P.], seq 81:122, ack 1, win 400, length 41
E..Q.U..d..=
..G4....A.PNc.Ol.,.P... ...&id=24C86E0785BB&mt=tower&sensor=00004291
11:13:38.424485 IP AcuRite-Hub.localdomain.1089 > ec2-52-6-137-198.compute-1.amazonaws.com.http: Flags [P.], seq 122:145, ack 1, win 400, length 23
E..?.V..d..N
..G4....A.PNc.xl.,.P.......&humidity=45&tempf=75.5
11:13:38.432247 IP AcuRite-Hub.localdomain.1089 > ec2-52-6-137-198.compute-1.amazonaws.com.http: Flags [P.], seq 145:181, ack 1, win 400, length 36
E..L.W..d..@
..G4....A.PNc..l.,.P...12..&baromin=30.46&battery=normal&rssi=4
11:13:38.433718 IP AcuRite-Hub.localdomain.1089 > ec2-52-6-137-198.compute-1.amazonaws.com.http: Flags [P.], seq 181:198, ack 1, win 400, length 17
E..9.X..d..R
..G4....A.PNc..l.,.P....... HTTP/1.1
Host: 
11:13:38.435585 IP AcuRite-Hub.localdomain.1089 > ec2-52-6-137-198.compute-1.amazonaws.com.http: Flags [P.], seq 198:239, ack 1, win 400, length 41
E..Q.Y..d..9
..G4....A.PNc..l.,.P...jI..hubapi.myacurite.com
User-Agent: Hub/224
11:13:38.448620 IP ec2-52-6-137-198.compute-1.amazonaws.com.http > AcuRite-Hub.localdomain.1089: Flags [.], ack 122, win 26883, length 0
E..(.G@....t4...
..G.P.Al.,.Nc.xP.i..x..
11:13:38.456353 IP ec2-52-6-137-198.compute-1.amazonaws.com.http > AcuRite-Hub.localdomain.1089: Flags [.], ack 145, win 26883, length 0
E..(.H@....s4...
..G.P.Al.,.Nc..P.i..a..
11:13:38.458516 IP AcuRite-Hub.localdomain.1089 > ec2-52-6-137-198.compute-1.amazonaws.com.http: Flags [P.], seq 239:262, ack 1, win 400, length 23
E..?.Z..d..J
..G4....A.PNc..l.,.P.......
Connection: close


11:13:38.463827 IP ec2-52-6-137-198.compute-1.amazonaws.com.http > AcuRite-Hub.localdomain.1089: Flags [.], ack 181, win 26883, length 0
E..(.I@....r4...
..G.P.Al.,.Nc..P.i..=..
11:13:38.463844 IP ec2-52-6-137-198.compute-1.amazonaws.com.http > AcuRite-Hub.localdomain.1089: Flags [.], ack 198, win 26883, length 0
E..(.J@....q4...
..G.P.Al.,.Nc..P.i..,..
11:13:38.463867 IP ec2-52-6-137-198.compute-1.amazonaws.com.http > AcuRite-Hub.localdomain.1089: Flags [.], ack 239, win 26883, length 0
E..(.K@....p4...
..G.P.Al.,.Nc..P.i.....
11:13:38.486580 IP ec2-52-6-137-198.compute-1.amazonaws.com.http > AcuRite-Hub.localdomain.1089: Flags [.], ack 262, win 26883, length 0
E..(.L@....o4...
..G.P.Al.,.Nc..P.i.....
11:13:38.491526 IP ec2-52-6-137-198.compute-1.amazonaws.com.http > AcuRite-Hub.localdomain.1089: Flags [P.], seq 1:401, ack 262, win 26883, length 400
E....M@.....4...
..G.P.Al.,.Nc..P.i.....HTTP/1.1 200 OK
Cache-Control: no-cache, no-store
Content-Type: application/json; charset=utf-8
Expires: Fri, 01 Jan 1990 00:00:00 GMT
Pragma: no-cache
X-Content-Type-Options: nosniff
X-Frame-Options: SAMEORIGIN
X-Request-Id: a243a0f7-c097-4cf2-a6f5-ab8b69956b42
X-Runtime: 0.003578
X-XSS-Protection: 1; mode=block
Content-Length: 45
Connection: Close

{"localtime":"11:11:11","checkvers
11:13:38.498422 IP AcuRite-Hub.localdomain.1089 > ec2-52-6-137-198.compute-1.amazonaws.com.http: Flags [.], ack 401, win 400, length 0
E..(.[..d..`
..G4....A.PNc..l.-.P...I.........
11:13:38.526631 IP ec2-52-6-137-198.compute-1.amazonaws.com.http > AcuRite-Hub.localdomain.1089: Flags [FP.], seq 401:412, ack 262, win 26883, length 11
E..3.N@....b4...
..G.P.Al.-.Nc..P.i..?..ion":"224"}
11:13:38.528134 IP AcuRite-Hub.localdomain.1089 > ec2-52-6-137-198.compute-1.amazonaws.com.http: Flags [.], ack 413, win 389, length 0
E..(.\..d.._
..G4....A.PNc..l.-.P...I.........
11:13:38.529199 IP AcuRite-Hub.localdomain.1089 > ec2-52-6-137-198.compute-1.amazonaws.com.http: Flags [.], ack 413, win 400, length 0
E..(.]..d..^
..G4....A.PNc..l.-.P...I.........
11:13:38.530244 IP AcuRite-Hub.localdomain.1089 > ec2-52-6-137-198.compute-1.amazonaws.com.http: Flags [F.], seq 262, ack 413, win 400, length 0
E..(.^..d..]
..G4....A.PNc..l.-.P...I.........
